{
  "$schema": "https://json-schema.org/draft/2020-12/schema",
  "$id": "envelope.v1.schema.json",
  "title": "EventEnvelope",
  "description": "Common envelope for the events theclub-api publishes to Kafka. The three event schemas (bet-placed, round-settled, wallet-transaction) extend it via allOf and override `data` with their specific payload.",
  "type": "object",
  "required": [
    "event_id",
    "event_type",
    "event_version",
    "occurred_at",
    "producer",
    "idempotency_key",
    "data"
  ],
  "properties": {
    "event_id": {
      "type": "string",
      "format": "uuid",
      "description": "Generated exactly once when the outbox row is inserted; stable across retries. It's the deduplication key for the consumer."
    },
    "event_type": {
      "type": "string",
      "enum": ["bet.placed", "round.settled", "wallet.transaction"]
    },
    "event_version": {
      "type": "integer",
      "const": 1
    },
    "occurred_at": {
      "type": "string",
      "format": "date-time",
      "description": "Business time (when it happened), not Kafka publish time."
    },
    "producer": {
      "type": "string",
      "const": "theclub-api"
    },
    "idempotency_key": {
      "type": ["string", "null"],
      "description": "The HTTP Idempotency-Key of the request that originated the event. null if the event doesn't come from a user request."
    },
    "data": {
      "type": "object",
      "description": "Payload specific to the event_type. See each event's schema."
    }
  },
  "additionalProperties": false
}
